Title,Brand,OS,RAM,CPU,Storage,Screen Size,Resolution,CPU Speed,Model,Wireless Technology,SIM Count,Wireless Provider,Cellular Technology,Camera,Color,Price,Price Before Promotion,Currancy,Rate,URL,IMG,Reviews,Website
Samsung Galaxy S20 FE rouge,SAMSUNG,"One UI 2.5, Android 10.0",6 GB,,128 GB,6.5 Inches,,,Samsung Galaxy S20 FE,,,Unlocked for All Carriers,LTE,,Azul Y Amarillo,€557.70,,€,3.9 out of 5 stars,https://www.amazon.nl/-/en/Samsung-Galaxy-S20-FE-Rot/dp/B08FTDFHCQ/ref=sr_1_115?dib=eyJ2IjoiMSJ9.29yrQNstw3Kmfwo-MC3T_K2tUChVeap0hbYtY8ZexhWm6EcEvueoreyUm0cxdcRdzsgM9388dLmIUp0K0Y2jXLc6M00Tl3h9I542HfkSC6MrvtCuFOnYnjaEQJvD5kTfCfz7HyUoi4Ga4lAC_KTKntaQrdVj30dr7Kl3IGowOFVmjMZXDcfXIipq1sQyjvzaGf5C6z9SeY-4G2xUI9NY7K9mTytX7El5jigN9XITLw0d6oZFFSgImWsA_DVqovZSAJAp-ybbtmd7yGXyyTRdk_POJer8TeBHm6cY5g72SQg.QQHV7t0im7kJgvdTuuNlTWMcON4YXCSGFBLS7wkVzgE&dib_tag=se&m=A17D2BRD4YMT0X&qid=1725663116&refinements=p_4%3ASAMSUNG%2Cp_n_condition-type%3A17170958031%2Cp_123%3A46655%2Cp_6%3AA17D2BRD4YMT0X&s=electronics&sr=1-115&language=en_GB,https://m.media-amazon.com/images/I/71lbwnkDhRL._AC_SL1500_.jpg,"[{'reviewer_name': 'Claudio', 'review_rating': 'N/A', 'review_title': 'N/A', 'review_text': ""Arrivato nei tempi, ben imballato, scatola chiusa. Cosa dire di più su questo telefono descritto bene in molte altre recensioni. Nnho ancora usato il riconoscimento facciale, l'impronta per ora non presenta difficoltà ad essere riconosciuta. Per quanto riguarda la batteria, contrariamente a quanto detto in altre recensioni, la durata per quanto mi riguarda è più che sufficiente e non ho notato neppure un eccessivo riscaldamento\nRead more"", 'review_date': 'Reviewed in Italy on 21 September 2022'}, {'reviewer_name': 'Dan H', 'review_rating': 'N/A', 'review_title': 'N/A', 'review_text': 'Delivered securely and safely wrapped, this quality product has lived up to all expectation.\nRead more', 'review_date': 'Reviewed in the United Kingdom on 15 November 2020'}, {'reviewer_name': 'Tojo2', 'review_rating': 'N/A', 'review_title': 'N/A', 'review_text': ""Came brand new & in a sealed Samsung Box & once set up it seems easy to use.  The one thing I find awkward are the 2 side buttons - they are almost flush to the body of the phone and exactly the same colour as the phone body and I find myself having to look at the side they are on to locate them.  They need to be just a bit more prominent for easy use.  As I have hearing issues, the sound is not particularly good & I need to use the phone on speaker.  You can turn the sound up but it doesn't remain on the highest level so has to be turned up every time.  That apart, I'm still learning all its functions.  I bought it through Amazon from Cheapest Electricals and before buying raised a couple of queries with them which they answered very promptly and fully. At the moment seems good value for money and nice to use. I don't use fingerprint or facial recognition so that's why they are 1 star as I can't comment on them..\nRead more"", 'review_date': 'Reviewed in the United Kingdom on 7 June 2024'}, {'reviewer_name': 'Fabio', 'review_rating': 'N/A', 'review_title': 'N/A', 'review_text': 'Come oramai da decenni seguo samsung e mi trovo alla grande. Asenza di jack un peccato, ormai il trend è quello , un po grande per le mie abitudini ma prestazioni super\nRead more', 'review_date': 'Reviewed in Italy on 26 October 2021'}, {'reviewer_name': 'Winifred Rose', 'review_rating': 'N/A', 'review_title': 'N/A', 'review_text': 'Love this phone. Has everything you need and more.\nRead more', 'review_date': 'Reviewed in the United Kingdom on 9 January 2021'}]",Amazon NL
Sam Galaxy S23 EE 256-8-5G-bk Sams Galaxy S23 EE 5G 256GB/8GB bk,SAMSUNG,android,,,256 GB,,,,SM-S911BZKGEEB,Wi-Fi,,Unlocked for All Carriers,5G,,phantom black,"€1,149.00",,€,4.0 out of 5 stars,https://www.amazon.nl/-/en/Sam-Galaxy-256-8-5G-bk-Sams-256GB/dp/B0BVKYZVY8/ref=sr_1_83?dib=eyJ2IjoiMSJ9.wLLVIcni-SJ9xpnEeWKynYzchCPGP9haMVMI5x2Y5Vac5g820iPtGPkLbVOp1RuJu77Tu3xWzVrN39S9rcGCoV1RJXVL75DxXFIZd-nhha7Bn7fAJLM0yhZo0lUQc2HU5zBP6UCVMNnV49WJJl5NbQN8YaFCiV-SRqDzSmwaqJmexVVfqgOR9Ad3YXAzgVv66eRSm6X5H1Jd0puscGe0uFOOC-uDN_n1PQU49H-pSAwQWmhEOu47LN451j1q7sHIAGn8U2tZvxeSul2qrqf4ZpZMGlq3RQyWza3Ga-cnwMA.mCN9kEE1DST8GHPFMz_GJdFKUvNrXKJkJx1HIL_TNzc&dib_tag=se&m=A17D2BRD4YMT0X&qid=1725663115&refinements=p_4%3ASAMSUNG%2Cp_n_condition-type%3A17170958031%2Cp_123%3A46655%2Cp_6%3AA17D2BRD4YMT0X&s=electronics&sr=1-83&language=en_GB,https://m.media-amazon.com/images/I/31EkgCnvZBL._AC_SL1422_.jpg,"[{'reviewer_name': 'Telefon kilifi gayet iyi', 'review_rating': 'N/A', 'review_title': 'N/A', 'review_text': 'Telefon harika\nRead more', 'review_date': 'Reviewed in Germany on 2 August 2024'}, {'reviewer_name': 'Amazon Kunde', 'review_rating': 'N/A', 'review_title': 'N/A', 'review_text': 'Akku hält weniger als ein Tag bei dem durchschnittlichen Gebrauch. Das ist weniger als bei meinem alten A22.\nRead more', 'review_date': 'Reviewed in Germany on 14 August 2024'}]",Amazon NL
Samsung GSM033702 pencil case,,,,,,,,,,,,,,,,€10.11,,€,5.0 out of 5 stars,https://www.amazon.nl/-/en/GSM033702-Samsung-pencil-case/dp/B07D9DMPJD/ref=sr_1_155?dib=eyJ2IjoiMSJ9.t5B-9n3EF0GrHplbyQlm7UYgNGz0GQx0O2OULXOViPXDOF3MG6AjVEh8f-Mz48P1hO3acWYOfd3DhICQu4M3wEWqUba0xMhP_4Jf_uiJHSyktppUdRylf79YLgaOCyUbcFGgJWaymawEy1c0FSS4ZPELXWwAggueDp0bZ-8lj0e95EJDELw7E4uMM3G4OLmJuCWT1td5qJxt1118lMoEylwROr8d2FYC_HHdFly2joxtFwLHBK35I6ASv1QbDjy3nNAFy9ELhVB1mpRpA5OC-H9Yci8Rr0xVfZuswJijFSg.5lxl5E1sr1NV-krSq4qz_f0MeDNXKdq4F8AqJ5HMVk0&dib_tag=se&m=A17D2BRD4YMT0X&qid=1725663120&refinements=p_4%3ASAMSUNG%2Cp_n_condition-type%3A17170958031%2Cp_123%3A46655%2Cp_6%3AA17D2BRD4YMT0X&s=electronics&sr=1-155&language=en_GB,https://m.media-amazon.com/images/I/61Nr3WB+6mL._AC_SL1000_.jpg,[],Amazon NL
Sam Galaxy S22 EU-256-8-5G-pk/gd | Samsung Galaxy S22 256/8GB pinkgold,SAMSUNG,android,,,256 GB,6.1 Inches,,,Galaxy S22,"GSM, Wi-Fi",,Unlocked,5G,,pink,€806.06,,€,4.2 out of 5 stars,https://www.amazon.nl/-/en/Sam-Galaxy-EU-256-8-5G-pk-Samsung-pinkgold/dp/B09QLB35VX/ref=sr_1_46?dib=eyJ2IjoiMSJ9.3OXEVbaRGUfBvOh6xVX1CFCjBAPfO-clCz3DBf3OuiGfw7aqNAxqmplpc9du7aNnCbLpTB7SYfilWSkqPlpnlIEiNQNf1de0lVLRCqY6b6pr8xzoSFIekJk8S1Z8Q62oi4lbSSge3uWTbeweLJRxDV0TIYdKXjPH78zPq99icFxAwkLaEWiQzCrGyX91HUb3vnVZ5nUUFVB5-z_tj7jrCPr_XW5534URyCRxGGn6fXSG3kriiYFy_cfxcgQZjiB5Y5bjXH6vh3S2UrV5zGxxcf9tP9tcNn0F2iwaqVt9mvg.4xebUwPhX6FXiAixIBbjwUMvBPKNr3OtY-0NoH9Asqg&dib_tag=se&m=A17D2BRD4YMT0X&qid=1725663112&refinements=p_4%3ASAMSUNG%2Cp_n_condition-type%3A17170958031%2Cp_123%3A46655%2Cp_6%3AA17D2BRD4YMT0X&s=electronics&sr=1-46&language=en_GB,https://m.media-amazon.com/images/I/71Y3IxPLcHL._AC_SL1500_.jpg,"[{'reviewer_name': 'ramoseli', 'review_rating': 'N/A', 'review_title': 'N/A', 'review_text': 'Gute Preis Leistung\nRead more', 'review_date': 'Reviewed in Germany on 20 July 2024'}, {'reviewer_name': 'Marzougui', 'review_rating': 'N/A', 'review_title': 'N/A', 'review_text': 'Au top\nRead more', 'review_date': 'Reviewed in France on 5 July 2024'}, {'reviewer_name': 'Ivan', 'review_rating': 'N/A', 'review_title': 'N/A', 'review_text': 'Arrivato nei tempi previsti ottimo prodotto sono soddisfatto\nRead more', 'review_date': 'Reviewed in Italy on 21 April 2024'}, {'reviewer_name': 'Lamberto', 'review_rating': 'N/A', 'review_title': 'N/A', 'review_text': 'Consegna veloce, pagamento comodamente a rate, prodotto ottimo ed efficace\nRead more', 'review_date': 'Reviewed in Italy on 4 March 2024'}, {'reviewer_name': 'Amazon Customer', 'review_rating': 'N/A', 'review_title': 'N/A', 'review_text': 'Schnelle Lieferung. Wie im Angebot beschrieben. Bin voll zufrieden\nRead more', 'review_date': 'Reviewed in Germany on 15 September 2023'}]",Amazon NL
GALAXY S24 ULTRA 12/512 BLACK,SAMSUNG,android,,,,6.8 Inches,,,SM-S928BZKHEUB,,,Unlocked for All Carriers,5G,,Black,"€1,349.00",,€,4.5 out of 5 stars,https://www.amazon.nl/-/en/GALAXY-S24-ULTRA-512-BLACK/dp/B0CSPK4FKF/ref=sr_1_9?dib=eyJ2IjoiMSJ9._38P4doI_dwPqmWAf6Cg50RGzpY4xRMdsQTY2fue4J3LA1rmGoCufPF8cQY5s2-TyQDCO9QfJowte634FVptXNDzuLc-EOOdMImNc6yZpsVGwiokt2MMuavBM5uMJ70_kivKhUZtUGgzQIX_f8Lh3A97fZPM-6Hls1LuM0EbMxmrACSWdr_L7iWSD59m0LUHX-2-_Etk6jqrDqdGd_sIke-5Y0KLzfdaWWdvPTTWm0bPhcVn_y47xw8sT8yVdIZlD2JSNTHQUmiSf9uPT8cH3DvTMjefdyL2MLxVlJWOi0s.s0Z7plUrybBMes7BDKo6Me5jrbKpcZFGzndofafe7uE&dib_tag=se&m=A17D2BRD4YMT0X&qid=1725663109&refinements=p_4%3ASAMSUNG%2Cp_n_condition-type%3A17170958031%2Cp_123%3A46655%2Cp_6%3AA17D2BRD4YMT0X&s=electronics&sr=1-9&language=en_GB,https://m.media-amazon.com/images/I/61uvELoqSCL._AC_SL1200_.jpg,"[{'reviewer_name': 'Cliente Amazon', 'review_rating': 'N/A', 'review_title': 'N/A', 'review_text': 'Estoy muy contento con el móvil, funciona a las mil maravillas la fluidez del procesador la pantalla bueno todo en jeneral que decir de este móvil que no se halla dicho ya un maquinon.\nRead more', 'review_date': 'Reviewed in Spain on 11 August 2024'}, {'reviewer_name': 'Dominique Lassabliere', 'review_rating': 'N/A', 'review_title': 'N/A', 'review_text': ""livre très rapidement. Mise en route encore plus rapide. Ecran ,vitesse d execution et caméras au top!!! en plus l'I A est génial...et le prix bien en dessous de tous les revendeurs !!!! BRAVO\nRead more"", 'review_date': 'Reviewed in France on 4 August 2024'}, {'reviewer_name': 'loccoposse', 'review_rating': 'N/A', 'review_title': 'N/A', 'review_text': 'Vorab: ich hatte bis dato das Galaxy S20 ultra. Damit war ich schon sehr zufrieden.Echt schickes Handy.Ich liebe es, das Handy ohne Hülle in der Hand zu halten.Es ist zwar groß, liegt dabei aber gut in der/den Hand/Händen.Das Display ist ist sehr klar und schön aufgelöst.Videos lassen sich damit sehr schön ansehen.Äußerst positiv ist, dass der Fingerabdruckscanner nochmal deutlich besser geworden ist. Ich brauch den Finger nur leich andrücken und er wird erkannt.Das Display ist gefühlt etwas empfindlicher geworden. Da passiert es schon mal, dass ich nach oben wischen möchte, dabei dann aber auch etwas diagonal wische. Hier kann es passieren, dass es seitwärts wischt. Nach einigen Versuchen klappte es dann aber problemlos.Die Geschwindigkeit beim arbeiten ist atemberaubend. Apps werde superschnell ausgeführt. Scrollen geht super flüssig. Es macht richtig Spaß.Natürlich kann ich auch Fotos mit dem Gerät machen. Die Qualität der Bilder ist echt toll.Ich bin sehr zufrieden und würde das Samsung Galaxy S24 Ultra jedem weiter empfehlen.\nRead more', 'review_date': 'Reviewed in Germany on 3 August 2024'}, {'reviewer_name': 'VITTORIA CUCURACHI', 'review_rating': 'N/A', 'review_title': 'N/A', 'review_text': 'Telefono top, molto veloce. Telecamera ottima. Nessun difetto per ora. Colori molto luminosi.\nRead more', 'review_date': 'Reviewed in Italy on 29 August 2024'}, {'reviewer_name': 'Tango', 'review_rating': 'N/A', 'review_title': 'N/A', 'review_text': 'Like others I was also a little apprehensive about buying this phone at a remarkably reduced price but I can confirm it is legit and works perfectly in the UK. Next day delivery, sealed box no issues. Been using it for 2 days and done all the updates connected it to Vodafone\nRead more', 'review_date': 'Reviewed in the United Kingdom on 31 July 2024'}]",Amazon NL
"Samsung Galaxy S9+ Smartphone (6.2 inch Touchscreen, 64 GB Internal Memory, Android, Single SIM) Midgnight Black – German Version",SAMSUNG,android,6 GB,,6 GB,6.2 Inches,1440 x 2960,"1.8, 2.7 GHz",Galaxy S9 Plus,,,Unlocked for All Carriers,1,,,"€1,136.41",,€,4.2 out of 5 stars,https://www.amazon.nl/-/en/Samsung-Smartphone-Touchscreen-Internal-Midgnight/dp/B079ZHNDJB/ref=sr_1_160?dib=eyJ2IjoiMSJ9.t5B-9n3EF0GrHplbyQlm7UYgNGz0GQx0O2OULXOViPXDOF3MG6AjVEh8f-Mz48P1hO3acWYOfd3DhICQu4M3wEWqUba0xMhP_4Jf_uiJHSyktppUdRylf79YLgaOCyUbcFGgJWaymawEy1c0FSS4ZPELXWwAggueDp0bZ-8lj0e95EJDELw7E4uMM3G4OLmJuCWT1td5qJxt1118lMoEylwROr8d2FYC_HHdFly2joxtFwLHBK35I6ASv1QbDjy3nNAFy9ELhVB1mpRpA5OC-H9Yci8Rr0xVfZuswJijFSg.5lxl5E1sr1NV-krSq4qz_f0MeDNXKdq4F8AqJ5HMVk0&dib_tag=se&m=A17D2BRD4YMT0X&qid=1725663120&refinements=p_4%3ASAMSUNG%2Cp_n_condition-type%3A17170958031%2Cp_123%3A46655%2Cp_6%3AA17D2BRD4YMT0X&s=electronics&sr=1-160&language=en_GB,https://m.media-amazon.com/images/I/71dd-elhT7L._AC_SL1500_.jpg,"[{'reviewer_name': 'silvia Boi', 'review_rating': 'N/A', 'review_title': 'N/A', 'review_text': 'Lo smartphone e ottimo , molto affidabile , peccato solo 64 giga\nRead more', 'review_date': 'Reviewed in Italy on 10 April 2024'}, {'reviewer_name': 'Rudi', 'review_rating': 'N/A', 'review_title': 'N/A', 'review_text': 'Tolles Handy. Samsung eben!!!! Jederzeit wieder. Dankeschön\nRead more', 'review_date': 'Reviewed in Germany on 14 March 2024'}, {'reviewer_name': 'alb', 'review_rating': 'N/A', 'review_title': 'N/A', 'review_text': ""Problème pour la livraison, la facture n'a pas été donnée après l'achat, je déconseille le site, pas professionnel.Concernant le téléphone l'écran s'est fêlé sans être tombé,ni aucuns chocs, qualité médiocre\nRead more"", 'review_date': 'Reviewed in France on 28 November 2023'}, {'reviewer_name': 'Lionel Martinez', 'review_rating': 'N/A', 'review_title': 'N/A', 'review_text': ""Mais bon, Bixby est tellement intrusif que je ne l'active pas.\nRead more"", 'review_date': 'Reviewed in France on 11 November 2019'}, {'reviewer_name': 'killerLP', 'review_rating': 'N/A', 'review_title': 'N/A', 'review_text': 'Todo bien, unico fallo el cable hacia mala conexion, teniendo en cuenta que era producto devolucion/reacondicionado con bastante descuento el cable es lo de menos. Por lo demas todo 10\nRead more', 'review_date': 'Reviewed in Spain on 24 October 2018'}]",Amazon NL
SAMSUNG - SMARTPHONE GALAXY Z FLIP3 5G BLACK 128GB 6.7IN 2640X1080 8GB 128GB ANDR 1,SAMSUNG,android,8 GB,,8 GB,6.7 Inches,,,Galaxy Z Flip 3,,,Unlocked,5G,,Black,"€1,059.00",,€,3.9 out of 5 stars,https://www.amazon.nl/-/en/SAMSUNG-SMARTPHONE-GALAXY-FLIP3-2640X1080/dp/B09HCTTSP4/ref=sr_1_103?dib=eyJ2IjoiMSJ9.29yrQNstw3Kmfwo-MC3T_K2tUChVeap0hbYtY8ZexhWm6EcEvueoreyUm0cxdcRdzsgM9388dLmIUp0K0Y2jXLc6M00Tl3h9I542HfkSC6MrvtCuFOnYnjaEQJvD5kTfCfz7HyUoi4Ga4lAC_KTKntaQrdVj30dr7Kl3IGowOFVmjMZXDcfXIipq1sQyjvzaGf5C6z9SeY-4G2xUI9NY7K9mTytX7El5jigN9XITLw0d6oZFFSgImWsA_DVqovZSAJAp-ybbtmd7yGXyyTRdk_POJer8TeBHm6cY5g72SQg.QQHV7t0im7kJgvdTuuNlTWMcON4YXCSGFBLS7wkVzgE&dib_tag=se&m=A17D2BRD4YMT0X&qid=1725663116&refinements=p_4%3ASAMSUNG%2Cp_n_condition-type%3A17170958031%2Cp_123%3A46655%2Cp_6%3AA17D2BRD4YMT0X&s=electronics&sr=1-103&language=en_GB,https://m.media-amazon.com/images/I/71NNXYHE80L._AC_SL1500_.jpg,"[{'reviewer_name': 'fabrice', 'review_rating': 'N/A', 'review_title': 'N/A', 'review_text': 'Très bon, produit et rapide en navigation et très bon sens pour écouter de la musique\nRead more', 'review_date': 'Reviewed in France on 5 May 2023'}, {'reviewer_name': 'Olgrim', 'review_rating': 'N/A', 'review_title': 'N/A', 'review_text': ""A l'heure où les smartphones se ressemblent tous, c'est sympa que Samsung ( et d'autres maintenant ) tentent de nouvelles choses.Quel intérêt pour celui-ci du coup?Le gain d'encombrement. Vous disposez d'un téléphone avec toutes les technologies modernes, doté d'un immense écran mais qui se plie en deux pour qu'il soit plus simple à rentrer dans une poche.C'est tout! Simple, mais pour ma part, les pelles à tartes qui pèse une tonne, ça commence à me gonfler.Points forts:Le concept, et l'exploit de l'écran pliable.L'écran en lui même n'est pas au rabais, magnifique, lisible en plein soleil, fluide, ( 120Hz adaptatif ) HDR...Complet et puissant.Il fait tout tourner, ( même les jeux gourmands) il a le WiFi 6, le Bluetooth 5.2 et la 5G.Niveau photos et vidéos, il est complet et très bon. ( Grand Angle, Ultra grand angle, caméra selfie et prise de vidéo en 4k 60 FPS )Points faibles:Autonomie.Pour ceux qui lâchent jamais leur téléphone ou qui joue beaucoup, gardez le chargeur à portée de main. Sinon, pour une utilisation comme la mienne, 30/40min de YouTube, quelques messages, un peu de Web et 2 ou 3h de musique, je rentre chez moi un peu avant 21h et j'ai toujours 40 à 50% de batterie.Enfin, la pliure est visible et on la sent.Sinon, la technologie de l'écran implique qu'il est plus sensible aux rayures et se salie facilement.Voilà, pour ceux qui veulent un grand écran sans avoir la poche déformée, ça peut être la solution.\nRead more"", 'review_date': 'Reviewed in France on 5 February 2023'}, {'reviewer_name': 'gomot', 'review_rating': 'N/A', 'review_title': 'N/A', 'review_text': ""bonjour ,Mon telephone a laché plus d' ecran que faire , je n'ai pas moyen de récuperer mes photos et numerosMerci de votre retour\nRead more"", 'review_date': 'Reviewed in France on 23 July 2024'}, {'reviewer_name': 'Wilfried morelle', 'review_rating': 'N/A', 'review_title': 'N/A', 'review_text': ""Le téléphone est conforme mais sur le descriptif du contenu il y a de marquer qu'il y a le kit main libre donc casque et c'est faux donc mensonger. Dommage car sinon tout était parfait\nRead more"", 'review_date': 'Reviewed in France on 24 March 2023'}, {'reviewer_name': 'Quand je l’es reçu les planches était cassé, très furieuse', 'review_rating': 'N/A', 'review_title': 'N/A', 'review_text': 'J’ai un problème avec mon téléphone je sais pas si il a une garantie ou pas ?\nRead more', 'review_date': 'Reviewed in France on 4 March 2024'}]",Amazon NL
Samsung GALAXY A32 BLACK EE 6.5IN 5G 128GB 4GB ANDROID 10,SAMSUNG,Android 10.0,,,128 GB,6.5 Inches,,,Galaxy A32,Wi-Fi,Dual SIM,,5G,,Black,€352.64,,€,Previous page,https://www.amazon.nl/-/en/Samsung-GALAXY-BLACK-6-5IN-ANDROID/dp/B08VH8Z5SX/ref=sr_1_110?dib=eyJ2IjoiMSJ9.29yrQNstw3Kmfwo-MC3T_K2tUChVeap0hbYtY8ZexhWm6EcEvueoreyUm0cxdcRdzsgM9388dLmIUp0K0Y2jXLc6M00Tl3h9I542HfkSC6MrvtCuFOnYnjaEQJvD5kTfCfz7HyUoi4Ga4lAC_KTKntaQrdVj30dr7Kl3IGowOFVmjMZXDcfXIipq1sQyjvzaGf5C6z9SeY-4G2xUI9NY7K9mTytX7El5jigN9XITLw0d6oZFFSgImWsA_DVqovZSAJAp-ybbtmd7yGXyyTRdk_POJer8TeBHm6cY5g72SQg.QQHV7t0im7kJgvdTuuNlTWMcON4YXCSGFBLS7wkVzgE&dib_tag=se&m=A17D2BRD4YMT0X&qid=1725663116&refinements=p_4%3ASAMSUNG%2Cp_n_condition-type%3A17170958031%2Cp_123%3A46655%2Cp_6%3AA17D2BRD4YMT0X&s=electronics&sr=1-110&language=en_GB,https://m.media-amazon.com/images/I/51MqaY6FP8L._AC_SL1200_.jpg,[],Amazon NL
Samsung GSM031954 pencil case,,,,,,,,,,,,,,,,€15.55,,€,5.0 out of 5 stars,https://www.amazon.nl/-/en/GSM031954-Samsung-pencil-case/dp/B07HP7T4CR/ref=sr_1_138?dib=eyJ2IjoiMSJ9.ACCVWqLowwIzyG4mYQrktJtzu5aW7_E5KkCWZEieZ0Aqu3WGfe9MC3SoxVOeXxFDgBEs_GdD8qg02GOTbVv6fjQpe0Wor4vNuFf4tA2apCO8LnUqTcjkdnbv_HJ8CCtwJvisReRZS6Vs3MkVJtydtNv2xIk2vwullVzf9ypJrPjd5SNS7mahqmCke6c8JO-d-e2wUIf7Ez2q_sHzWTJhmQE9NsdcPqzRBWpLw5LEAzpipyBhpnFG84rdf9ojHEbVhEm8h-pfugk-Lu8X1gvzBno-BSTaDV82udRYvEYb358.e2JmLe5aP83BXLH5CkPB7L7lEjUwLDHT8tV63_UX_hA&dib_tag=se&m=A17D2BRD4YMT0X&qid=1725663118&refinements=p_4%3ASAMSUNG%2Cp_n_condition-type%3A17170958031%2Cp_123%3A46655%2Cp_6%3AA17D2BRD4YMT0X&s=electronics&sr=1-138&language=en_GB,https://m.media-amazon.com/images/I/71RAEOkawuL._AC_SL1500_.jpg,[],Amazon NL
Samsung GSM036210 Case,SAMSUNG,,,,,2.8,,,,,,,,,,€12.06,,€,5.0 out of 5 stars,https://www.amazon.nl/-/en/GSM036210-Samsung-Case/dp/B07HP8FPYW/ref=sr_1_132?dib=eyJ2IjoiMSJ9.ACCVWqLowwIzyG4mYQrktJtzu5aW7_E5KkCWZEieZ0Aqu3WGfe9MC3SoxVOeXxFDgBEs_GdD8qg02GOTbVv6fjQpe0Wor4vNuFf4tA2apCO8LnUqTcjkdnbv_HJ8CCtwJvisReRZS6Vs3MkVJtydtNv2xIk2vwullVzf9ypJrPjd5SNS7mahqmCke6c8JO-d-e2wUIf7Ez2q_sHzWTJhmQE9NsdcPqzRBWpLw5LEAzpipyBhpnFG84rdf9ojHEbVhEm8h-pfugk-Lu8X1gvzBno-BSTaDV82udRYvEYb358.e2JmLe5aP83BXLH5CkPB7L7lEjUwLDHT8tV63_UX_hA&dib_tag=se&m=A17D2BRD4YMT0X&qid=1725663118&refinements=p_4%3ASAMSUNG%2Cp_n_condition-type%3A17170958031%2Cp_123%3A46655%2Cp_6%3AA17D2BRD4YMT0X&s=electronics&sr=1-132&language=en_GB,https://m.media-amazon.com/images/I/7166X0Re-eL._AC_SL1500_.jpg,[],Amazon NL
"Samsung Galaxy S23 Ultra Smartphone, Purple, 256 GB, 6.8 Inches, Octa-Core",SAMSUNG,Android 8.1,,,256 GB,6.8 Inches,,,Galaxy S23,"GSM, Wi-Fi, LTE",Dual SIM,,,,Multicolour,"€2,319.17",,€,4.0 out of 5 stars,https://www.amazon.nl/-/en/Samsung-Galaxy-Smartphone-Purple-Octa-Core/dp/B0CBMW25GP/ref=sr_1_71?dib=eyJ2IjoiMSJ9.h-o9j2CGAT82QG2_Blb0QwGHhE9y_68HfsznsYll2goDgDlL-czh2HljU0rEwakrtcISxa51DFTKy0HiIWQGuNCgC8kBbEmu5YF_ca2GXR3OHhxwSfu8q3NnZwYGtR8qVQnuRixHMluIlha1p4yQ6WYMnFeAhnVh8LsrbeY_a7J1ua3qwRR5_3SkpbQW6GNauBy75tqKRiTxJxcrq4gAEU_kvmrhejGFVauG0PPzzbEJtAE5BZqiiPH94N43YzQg6jjZJjYe35o1jKWRrTnZE7pdvYHNyaafWAd8ZjiMtZY.EJBqAsgfURqlmFgsQH60vuqoptvroq1sTrgsBW0l8IY&dib_tag=se&m=A17D2BRD4YMT0X&qid=1725663113&refinements=p_4%3ASAMSUNG%2Cp_n_condition-type%3A17170958031%2Cp_123%3A46655%2Cp_6%3AA17D2BRD4YMT0X&s=electronics&sr=1-71&language=en_GB,https://m.media-amazon.com/images/I/51zfZ9JVRAL._AC_SL1200_.jpg,"[{'reviewer_name': 'Lilly', 'review_rating': 'N/A', 'review_title': 'N/A', 'review_text': 'Bel cellulare con tante funzionalità. Peccato solo che il 5g non abbia mai preso...eppure la compagnia tel. è abilitata.Non saprei da cosa possa dipendere\nRead more', 'review_date': 'Reviewed in Italy on 21 December 2023'}]",Amazon NL
Sam Galaxy S22 Ultra EU-128-8-5G-rd | Sams Gal S22 Ultra 5G 128/8 Burgundy,SAMSUNG,android,,,128 GB,,1440 x 3120,2.8 GHz,Galaxy S22,,,Unlocked,5G,,,"€1,263.80",,€,4.2 out of 5 stars,https://www.amazon.nl/-/en/Galaxy-Ultra-EU-128-8-5G-rd-Sams-Burgundy/dp/B09QL98QPL/ref=sr_1_44?dib=eyJ2IjoiMSJ9.3OXEVbaRGUfBvOh6xVX1CFCjBAPfO-clCz3DBf3OuiGfw7aqNAxqmplpc9du7aNnCbLpTB7SYfilWSkqPlpnlIEiNQNf1de0lVLRCqY6b6pr8xzoSFIekJk8S1Z8Q62oi4lbSSge3uWTbeweLJRxDV0TIYdKXjPH78zPq99icFxAwkLaEWiQzCrGyX91HUb3vnVZ5nUUFVB5-z_tj7jrCPr_XW5534URyCRxGGn6fXSG3kriiYFy_cfxcgQZjiB5Y5bjXH6vh3S2UrV5zGxxcf9tP9tcNn0F2iwaqVt9mvg.4xebUwPhX6FXiAixIBbjwUMvBPKNr3OtY-0NoH9Asqg&dib_tag=se&m=A17D2BRD4YMT0X&qid=1725663112&refinements=p_4%3ASAMSUNG%2Cp_n_condition-type%3A17170958031%2Cp_123%3A46655%2Cp_6%3AA17D2BRD4YMT0X&s=electronics&sr=1-44&language=en_GB,https://m.media-amazon.com/images/I/81wr-DEk4UL._AC_SL1500_.jpg,"[{'reviewer_name': 'Sarah', 'review_rating': 'N/A', 'review_title': 'N/A', 'review_text': ""Reçu rapidement. Téléphone neuf . Fonctionne bien . Avant j'étais chez iPhone donc il faut un petit temps d'adaptation pour découvrir les fonctionnalités du téléphone.. il est très grand et fait de magnifiques photos. Très bonne qualité.\nRead more"", 'review_date': 'Reviewed in France on 4 August 2024'}, {'reviewer_name': 'luana benedetti', 'review_rating': 'N/A', 'review_title': 'N/A', 'review_text': 'Favoloso.\nRead more', 'review_date': 'Reviewed in Italy on 12 May 2024'}, {'reviewer_name': 'Rogalski', 'review_rating': 'N/A', 'review_title': 'N/A', 'review_text': 'Handy ist neu . Alles funktioniert gut. Und wie weiter zeigt sich Gerät brauche noch Zeit. Sonst kann nur weiter empfehlen.\nRead more', 'review_date': 'Reviewed in Germany on 4 February 2024'}, {'reviewer_name': 'roman', 'review_rating': 'N/A', 'review_title': 'N/A', 'review_text': 'Klasse Ware\nRead more', 'review_date': 'Reviewed in Germany on 1 March 2024'}, {'reviewer_name': 'FaDì', 'review_rating': 'N/A', 'review_title': 'N/A', 'review_text': 'Mi son fatta un regalo, chi arriva a decidere di avere il Samsung s22ultra sa che ciò che cerca la troverà in questo device ⭐⭐⭐⭐⭐\nRead more', 'review_date': 'Reviewed in Italy on 3 January 2023'}]",Amazon NL
Samsung GALAXY Z FLIP3 5G SM-F711B 17 cm (6.7 inch) Android 11 USB TYPE-C 8 GB 256 GB 3300 mAh Black,SAMSUNG,Android 10.0,8 GB,,12 GB,6.7 Inches,,,SAMSUNG GALAXY Z FLIP3 5G SM-F711B 17 cm (6.7 inch) ANDROID 11 USB TYPE-C 8 GB 256 GB 3300 mAh Black,,,Unlocked for All Carriers,5G,,,€850.59,,€,5.0 out of 5 stars,https://www.amazon.nl/-/en/Samsung-GALAXY-SM-F711B-Android-TYPE-C/dp/B09GS5LX6S/ref=sr_1_105?dib=eyJ2IjoiMSJ9.29yrQNstw3Kmfwo-MC3T_K2tUChVeap0hbYtY8ZexhWm6EcEvueoreyUm0cxdcRdzsgM9388dLmIUp0K0Y2jXLc6M00Tl3h9I542HfkSC6MrvtCuFOnYnjaEQJvD5kTfCfz7HyUoi4Ga4lAC_KTKntaQrdVj30dr7Kl3IGowOFVmjMZXDcfXIipq1sQyjvzaGf5C6z9SeY-4G2xUI9NY7K9mTytX7El5jigN9XITLw0d6oZFFSgImWsA_DVqovZSAJAp-ybbtmd7yGXyyTRdk_POJer8TeBHm6cY5g72SQg.QQHV7t0im7kJgvdTuuNlTWMcON4YXCSGFBLS7wkVzgE&dib_tag=se&m=A17D2BRD4YMT0X&qid=1725663116&refinements=p_4%3ASAMSUNG%2Cp_n_condition-type%3A17170958031%2Cp_123%3A46655%2Cp_6%3AA17D2BRD4YMT0X&s=electronics&sr=1-105&language=en_GB,https://m.media-amazon.com/images/I/51DCDEDXBZL._AC_SL1200_.jpg,[],Amazon NL
