Title,Brand,OS,RAM,CPU,Storage,Screen Size,Resolution,CPU Speed,Model,Wireless Technology,SIM Count,Wireless Provider,Cellular Technology,Camera,Color,Price,Price Before Promotion,Currancy,Rate,URL,IMG,Reviews,Website
"Samsung Galaxy S21 5G Smartphone, 128 GB, 8 GB RAM, Dual SIM, Grey",SAMSUNG,Android 11.0,8 GB,,8 GB,6.2 Inches,,,Samsung Galaxy S21 5G,,,Unlocked for All Carriers,5G,,Grey,€401.00,,€,3.7 out of 5 stars,https://www.amazon.nl/-/en/Samsung-Galaxy-Smartphone-Dual-Grey/dp/B08R93X867/ref=sr_1_35?dib=eyJ2IjoiMSJ9.3OXEVbaRGUfBvOh6xVX1CFCjBAPfO-clCz3DBf3OuiGfw7aqNAxqmplpc9du7aNnCbLpTB7SYfilWSkqPlpnlIEiNQNf1de0lVLRCqY6b6pr8xzoSFIekJk8S1Z8Q62oi4lbSSge3uWTbeweLJRxDV0TIYdKXjPH78zPq99icFxAwkLaEWiQzCrGyX91HUb3vnVZ5nUUFVB5-z_tj7jrCPr_XW5534URyCRxGGn6fXSG3kriiYFy_cfxcgQZjiB5Y5bjXH6vh3S2UrV5zGxxcf9tP9tcNn0F2iwaqVt9mvg.4xebUwPhX6FXiAixIBbjwUMvBPKNr3OtY-0NoH9Asqg&dib_tag=se&m=A17D2BRD4YMT0X&qid=1725663112&refinements=p_4%3ASAMSUNG%2Cp_n_condition-type%3A17170958031%2Cp_123%3A46655%2Cp_6%3AA17D2BRD4YMT0X&s=electronics&sr=1-35&language=en_GB,https://m.media-amazon.com/images/I/81g7zh69wYL._AC_SL1500_.jpg,"[{'reviewer_name': 'Gil ROY', 'review_rating': 'N/A', 'review_title': 'N/A', 'review_text': 'je voulais un mobile pas trop grand\nRead more', 'review_date': 'Reviewed in France on 30 July 2024'}, {'reviewer_name': 'Cliente Amazon', 'review_rating': 'N/A', 'review_title': 'N/A', 'review_text': 'Compré un teléfono Samsung Galaxy S21 5g a finales de enero el 21 de mayo el teléfono se actualiza y deja de funcionar la pantalla tactil, llamo a Samsung y me remiten al servicio técnico situado en la 4 planta de el corte inglés de Bilbao.El técnico me dice que el teléfono no está en garantía que está dado de alta hace 4 años y ha sido abierto y se observan signos de humedad al estar el terminal mal sellado.Estafado por Amazon ya que yo compré un terminal nuevo no uno reacondicionado. Respuesta de Amazon que es un vendedor externo.Alguna responsabilidad tendrá Amazon de los productos que venden en su web.Devuelvo el terminal y espero la devolución del importe pagado.\nRead more', 'review_date': 'Reviewed in Spain on 23 May 2024'}, {'reviewer_name': 'Roman Brehm', 'review_rating': 'N/A', 'review_title': 'N/A', 'review_text': 'Gute Preise Leistung\nRead more', 'review_date': 'Reviewed in Germany on 3 February 2024'}, {'reviewer_name': 'Peppe', 'review_rating': 'N/A', 'review_title': 'N/A', 'review_text': 'Sborsare cosi tanti soldi per un telefono top di gamma con una batteria ridicola. Che non arriva a 9 ore , con uso quotidiano . Temperature del telefono sempre superiore ai 33 gradi fino ad arrivare ai 48 con un uso intenso , restituito subito.\nRead more', 'review_date': 'Reviewed in Italy on 7 June 2022'}, {'reviewer_name': 'Rochdi A.', 'review_rating': 'N/A', 'review_title': 'N/A', 'review_text': ""Très déçu de cet achat. Ecouteurs non fournis contrairement à ce que dit l'annonce et le plus important comme le signalent d'autres commentaires, le téléphone ne marche pas avec une carte sim française de chez free. Comment Amazon peut vendre (ou laisser vendre) en France des produits qui ne fonctionnent pas en France ?. J'ai retourné le téléphone, mais la confiance en a pris un coup.\nRead more"", 'review_date': 'Reviewed in France on 21 June 2024'}]",Amazon NL
Samsung Galaxy M55 5G M556 128GB/8GB Dual SIM Azul Oscuro,,,,,,,,,,,,,,,,€501.77,,€,5.0 out of 5 stars,https://www.amazon.nl/-/en/Samsung-Galaxy-M556-128GB-Oscuro/dp/B0CZXTFLDN/ref=sr_1_64?dib=eyJ2IjoiMSJ9.h-o9j2CGAT82QG2_Blb0QwGHhE9y_68HfsznsYll2goDgDlL-czh2HljU0rEwakrtcISxa51DFTKy0HiIWQGuNCgC8kBbEmu5YF_ca2GXR3OHhxwSfu8q3NnZwYGtR8qVQnuRixHMluIlha1p4yQ6WYMnFeAhnVh8LsrbeY_a7J1ua3qwRR5_3SkpbQW6GNauBy75tqKRiTxJxcrq4gAEU_kvmrhejGFVauG0PPzzbEJtAE5BZqiiPH94N43YzQg6jjZJjYe35o1jKWRrTnZE7pdvYHNyaafWAd8ZjiMtZY.EJBqAsgfURqlmFgsQH60vuqoptvroq1sTrgsBW0l8IY&dib_tag=se&m=A17D2BRD4YMT0X&qid=1725663113&refinements=p_4%3ASAMSUNG%2Cp_n_condition-type%3A17170958031%2Cp_123%3A46655%2Cp_6%3AA17D2BRD4YMT0X&s=electronics&sr=1-64&language=en_GB,https://m.media-amazon.com/images/I/611zid24DqL._AC_SL1200_.jpg,"[{'reviewer_name': 'antonio galvan', 'review_rating': 'N/A', 'review_title': 'N/A', 'review_text': 'perfecto\nRead more', 'review_date': 'Reviewed in Spain on 22 August 2024'}]",Amazon NL
Samsung GSM034018 Case,SAMSUNG,,,,,1.6,,,,,,,,,,€13.39,,€,5.0 out of 5 stars,https://www.amazon.nl/-/en/GSM034018-Samsung-Case/dp/B07HP657MK/ref=sr_1_143?dib=eyJ2IjoiMSJ9.ACCVWqLowwIzyG4mYQrktJtzu5aW7_E5KkCWZEieZ0Aqu3WGfe9MC3SoxVOeXxFDgBEs_GdD8qg02GOTbVv6fjQpe0Wor4vNuFf4tA2apCO8LnUqTcjkdnbv_HJ8CCtwJvisReRZS6Vs3MkVJtydtNv2xIk2vwullVzf9ypJrPjd5SNS7mahqmCke6c8JO-d-e2wUIf7Ez2q_sHzWTJhmQE9NsdcPqzRBWpLw5LEAzpipyBhpnFG84rdf9ojHEbVhEm8h-pfugk-Lu8X1gvzBno-BSTaDV82udRYvEYb358.e2JmLe5aP83BXLH5CkPB7L7lEjUwLDHT8tV63_UX_hA&dib_tag=se&m=A17D2BRD4YMT0X&qid=1725663118&refinements=p_4%3ASAMSUNG%2Cp_n_condition-type%3A17170958031%2Cp_123%3A46655%2Cp_6%3AA17D2BRD4YMT0X&s=electronics&sr=1-143&language=en_GB,https://m.media-amazon.com/images/I/71fGftvnAaL._AC_SL1500_.jpg,[],Amazon NL
Samsung compatible Galaxy S22 5G White 128Go,SAMSUNG,Android 8.1,,,8 GB,6.1 Inches,2340 x 1080,,Galaxy S22,,,Unlocked,5G,,White,€862.84,,€,4.2 out of 5 stars,https://www.amazon.nl/-/en/Samsung-compatible-Galaxy-White-128Go/dp/B09RKJR2RH/ref=sr_1_93?dib=eyJ2IjoiMSJ9.wLLVIcni-SJ9xpnEeWKynYzchCPGP9haMVMI5x2Y5Vac5g820iPtGPkLbVOp1RuJu77Tu3xWzVrN39S9rcGCoV1RJXVL75DxXFIZd-nhha7Bn7fAJLM0yhZo0lUQc2HU5zBP6UCVMNnV49WJJl5NbQN8YaFCiV-SRqDzSmwaqJmexVVfqgOR9Ad3YXAzgVv66eRSm6X5H1Jd0puscGe0uFOOC-uDN_n1PQU49H-pSAwQWmhEOu47LN451j1q7sHIAGn8U2tZvxeSul2qrqf4ZpZMGlq3RQyWza3Ga-cnwMA.mCN9kEE1DST8GHPFMz_GJdFKUvNrXKJkJx1HIL_TNzc&dib_tag=se&m=A17D2BRD4YMT0X&qid=1725663115&refinements=p_4%3ASAMSUNG%2Cp_n_condition-type%3A17170958031%2Cp_123%3A46655%2Cp_6%3AA17D2BRD4YMT0X&s=electronics&sr=1-93&language=en_GB,https://m.media-amazon.com/images/I/818z1fzFRBL._AC_SL1500_.jpg,"[{'reviewer_name': 'Emma', 'review_rating': 'N/A', 'review_title': 'N/A', 'review_text': ""Je partage ma première impression. Pour les performances , je reviendrai ultérieurement après quelques mois d'essai.Donc pour l'instant , reçu très rapidement. Emballage soigné.Design parfait ( couleur blanc). Etant adepte des formats compacts, je suis ravie car je recherchais surtout un smartphone de taille correcte pour être utilisé d'une main, ras le bol de ces smartphones trop grands et encombrants....Alors je suis ravie du format . La mise en route et l'utilisation très simple.Je suis satisfaite de cet achat.\nRead more"", 'review_date': 'Reviewed in France on 31 July 2024'}, {'reviewer_name': 'Harley', 'review_rating': 'N/A', 'review_title': 'N/A', 'review_text': 'il telefono è in perfette condizioni\nRead more', 'review_date': 'Reviewed in Italy on 30 June 2023'}, {'reviewer_name': 'marcelthebiker', 'review_rating': 'N/A', 'review_title': 'N/A', 'review_text': ""belle réalisation, parfait pour la grandeur, batterie tient 2 jours à mon utilisation,mais les photos n'apportent pas d'améliorations en qualités par rapport à mon s10 au contraire.Grand angle déforme beaucoup plus l'image.Conclusion prix surfait pour rien de plus\nRead more"", 'review_date': 'Reviewed in Belgium on 15 April 2023'}, {'reviewer_name': 'S22 top', 'review_rating': 'N/A', 'review_title': 'N/A', 'review_text': ""Super téléphone, reçu très rapidement, j'en suis très contente\nRead more"", 'review_date': 'Reviewed in France on 7 March 2024'}, {'reviewer_name': 'Sophie', 'review_rating': 'N/A', 'review_title': 'N/A', 'review_text': ""J'avais un Samsung S9 de 5ans et j'ai acheté ce S22. Je ne pensais pas ressentir une telle différence! Les photos sont bien meilleures surtout en clair-obscure. Le son est aussi amélioré, l'écran est top et il est beaucoup plus réactif dans tous les domaines.Je suis éligible aussi à l'offre de remboursement Samsung de 100€ ce qui n'est pas négligeable !Bref super contente de mon achat.Le plus : la livraison Amazon en point relais\nRead more"", 'review_date': 'Reviewed in France on 15 May 2023'}]",Amazon NL
Samsung GSM030773 Case,SAMSUNG,,,,,,,,,,,,,,Blue,€8.64,,€,5.0 out of 5 stars,https://www.amazon.nl/-/en/GSM030773-Samsung-Case/dp/B077GXC9XP/ref=sr_1_163?dib=eyJ2IjoiMSJ9.t5B-9n3EF0GrHplbyQlm7UYgNGz0GQx0O2OULXOViPXDOF3MG6AjVEh8f-Mz48P1hO3acWYOfd3DhICQu4M3wEWqUba0xMhP_4Jf_uiJHSyktppUdRylf79YLgaOCyUbcFGgJWaymawEy1c0FSS4ZPELXWwAggueDp0bZ-8lj0e95EJDELw7E4uMM3G4OLmJuCWT1td5qJxt1118lMoEylwROr8d2FYC_HHdFly2joxtFwLHBK35I6ASv1QbDjy3nNAFy9ELhVB1mpRpA5OC-H9Yci8Rr0xVfZuswJijFSg.5lxl5E1sr1NV-krSq4qz_f0MeDNXKdq4F8AqJ5HMVk0&dib_tag=se&m=A17D2BRD4YMT0X&qid=1725663120&refinements=p_4%3ASAMSUNG%2Cp_n_condition-type%3A17170958031%2Cp_123%3A46655%2Cp_6%3AA17D2BRD4YMT0X&s=electronics&sr=1-163&language=en_GB,https://m.media-amazon.com/images/I/51osEa5BFPL.__AC_SX300_SY300_QL70_ML2_.jpg,[],Amazon NL
Samsung Galaxy M32 SIM Free Smartphone 6.4 inch Android mobile phone 6GB RAM 128GB memory white [United Kingdom version],SAMSUNG,"Android 11.0, One UI 3.1",6 GB,,128 GB,6.4 Inches,,,10 UK Medium,,,Unlocked for All Carriers,4G,,,€331.63,,€,4.5 out of 5 stars,https://www.amazon.nl/-/en/SM-M325FZWGEUA/dp/B095XBCBD9/ref=sr_1_109?dib=eyJ2IjoiMSJ9.29yrQNstw3Kmfwo-MC3T_K2tUChVeap0hbYtY8ZexhWm6EcEvueoreyUm0cxdcRdzsgM9388dLmIUp0K0Y2jXLc6M00Tl3h9I542HfkSC6MrvtCuFOnYnjaEQJvD5kTfCfz7HyUoi4Ga4lAC_KTKntaQrdVj30dr7Kl3IGowOFVmjMZXDcfXIipq1sQyjvzaGf5C6z9SeY-4G2xUI9NY7K9mTytX7El5jigN9XITLw0d6oZFFSgImWsA_DVqovZSAJAp-ybbtmd7yGXyyTRdk_POJer8TeBHm6cY5g72SQg.QQHV7t0im7kJgvdTuuNlTWMcON4YXCSGFBLS7wkVzgE&dib_tag=se&m=A17D2BRD4YMT0X&qid=1725663116&refinements=p_4%3ASAMSUNG%2Cp_n_condition-type%3A17170958031%2Cp_123%3A46655%2Cp_6%3AA17D2BRD4YMT0X&s=electronics&sr=1-109&language=en_GB,https://m.media-amazon.com/images/I/71gko+nX9KS._AC_SL1500_.jpg,"[{'reviewer_name': 'rachel wells', 'review_rating': 'N/A', 'review_title': 'N/A', 'review_text': 'Really good quality phone at a great price\nRead more', 'review_date': 'Reviewed in the United Kingdom on 28 March 2023'}, {'reviewer_name': 'mia', 'review_rating': 'N/A', 'review_title': 'N/A', 'review_text': 'Ich komme gut zurecht damit\nRead more', 'review_date': 'Reviewed in Germany on 22 January 2023'}, {'reviewer_name': 'Mr. A. Jacobs', 'review_rating': 'N/A', 'review_title': 'N/A', 'review_text': 'battery long usage, large screen, good os, value for money\nRead more', 'review_date': 'Reviewed in the United Kingdom on 6 August 2022'}, {'reviewer_name': 'ULF', 'review_rating': 'N/A', 'review_title': 'N/A', 'review_text': 'Eigentlich ein schönes Gerät, Habe mit dem Vorgänger Model gute Erfahrungen gesammelt.Hatte nur Probleme Daten über mobile /WLAN zu laden.Muste saß Gerät wieder zurück auf die Insel sendenService von Amazon war trotz Import Gerät super gelöst.\nRead more', 'review_date': 'Reviewed in Germany on 8 February 2022'}, {'reviewer_name': 'Peter Harris', 'review_rating': 'N/A', 'review_title': 'N/A', 'review_text': 'I enjoy this phone, it is easy to use and the photos are good.  Only  draw back is I thought it was 4g. But my network provider says it is only 3g. Which is going to be a problem when they switch off 3g.\nRead more', 'review_date': 'Reviewed in the United Kingdom on 21 March 2023'}]",Amazon NL
Samsung Galaxy Note 9 128GB Dual SIM Ocean Blue,SAMSUNG,android,,,128 GB,6.4 Inches,1440 x 2960,2.7 GHz,Galaxy Note 9,,,Unlocked,"4G, 2G",,,"€1,058.85",,€,4.2 out of 5 stars,https://www.amazon.nl/-/en/Samsung-Galaxy-Note-128GB-Ocean/dp/B07G4M9S74/ref=sr_1_145?dib=eyJ2IjoiMSJ9.t5B-9n3EF0GrHplbyQlm7UYgNGz0GQx0O2OULXOViPXDOF3MG6AjVEh8f-Mz48P1hO3acWYOfd3DhICQu4M3wEWqUba0xMhP_4Jf_uiJHSyktppUdRylf79YLgaOCyUbcFGgJWaymawEy1c0FSS4ZPELXWwAggueDp0bZ-8lj0e95EJDELw7E4uMM3G4OLmJuCWT1td5qJxt1118lMoEylwROr8d2FYC_HHdFly2joxtFwLHBK35I6ASv1QbDjy3nNAFy9ELhVB1mpRpA5OC-H9Yci8Rr0xVfZuswJijFSg.5lxl5E1sr1NV-krSq4qz_f0MeDNXKdq4F8AqJ5HMVk0&dib_tag=se&m=A17D2BRD4YMT0X&qid=1725663120&refinements=p_4%3ASAMSUNG%2Cp_n_condition-type%3A17170958031%2Cp_123%3A46655%2Cp_6%3AA17D2BRD4YMT0X&s=electronics&sr=1-145&language=en_GB,https://m.media-amazon.com/images/I/71-nA8D-+yL._AC_SL1500_.jpg,"[{'reviewer_name': 'DENISE PREWITT-REED', 'review_rating': 'N/A', 'review_title': 'N/A', 'review_text': 'I got this phone for a wonderful  price...\nRead more', 'review_date': 'Reviewed in the United States on 18 December 2022'}, {'reviewer_name': 'Steffen Roch', 'review_rating': 'N/A', 'review_title': 'N/A', 'review_text': 'Ich habe das Telefon gekauft, weil ich sehr zufrieden mit meinem alten Note 9 war. Leider habe ich einen kleinen Displayschaden an meinem alten Telefon. Daher nun das neue.  Dies sieht zwar optisch top aus, lässt aber nur einen sehr schlechten Empfang zu. Eine Reklamation gestaltet sich im Moment sehr schwer. Nun benutze ich wieser mein altes Telefon und drehe mich im Kreis mit dem Händler wegen der Reklamation.Nun bekam ich vom Hersteller das Telefon mit gesprungen Rücken zurück. Und das mit Vorsatz, da eine Hülle darum gemacht wurde um nicht zu erkennen das es defekt ist.\nRead more', 'review_date': 'Reviewed in Germany on 27 June 2024'}, {'reviewer_name': 'Alessio', 'review_rating': 'N/A', 'review_title': 'N/A', 'review_text': 'Come da titolo, questo note9 non ha nulla da invidiare al suo fratello maggiore note10 ne per durata della batteria, tantomento per lo schermo che resta comunque uno dei migliori.\nRead more', 'review_date': 'Reviewed in Italy on 15 June 2024'}, {'reviewer_name': 'padma', 'review_rating': 'N/A', 'review_title': 'N/A', 'review_text': 'Einfach solides, aber hochwertiges Handy schon für Sohn, Frau ,mich bestellt alle sehr zufrieden.\nRead more', 'review_date': 'Reviewed in Germany on 14 May 2024'}, {'reviewer_name': 'Angelo', 'review_rating': 'N/A', 'review_title': 'N/A', 'review_text': ""In generale un bello smartphone i pro, dotato di molte funzioni all'avanguardia supporta ancora molte applicazioni pur disponendo di un sistema Android 10 molto preciso e con tante opzioni. I contro, a mio parere sono la scarsa durata della carica di batteria rispetto a altri smartphone e non ė semplice e pratico come ad esempio il Samsung Galaxy note 3 con con le loro rispettive S-View Cover. Comunque rimane un gran bel telefono\nRead more"", 'review_date': 'Reviewed in Italy on 9 April 2024'}]",Amazon NL
Samsung Galaxy A53 5G 128GB Blue,SAMSUNG,Android 12.0,6 GB,,128 GB,6.5 Inches,,2.4 GHz,Galaxy A53 5G,,,Unlocked for All Carriers,5G,,,€379.00,,€,4.4 out of 5 stars,https://www.amazon.nl/-/en/Samsung-Galaxy-A53-128GB-Blue/dp/B09QH4B1Q5/ref=sr_1_53?dib=eyJ2IjoiMSJ9.h-o9j2CGAT82QG2_Blb0QwGHhE9y_68HfsznsYll2goDgDlL-czh2HljU0rEwakrtcISxa51DFTKy0HiIWQGuNCgC8kBbEmu5YF_ca2GXR3OHhxwSfu8q3NnZwYGtR8qVQnuRixHMluIlha1p4yQ6WYMnFeAhnVh8LsrbeY_a7J1ua3qwRR5_3SkpbQW6GNauBy75tqKRiTxJxcrq4gAEU_kvmrhejGFVauG0PPzzbEJtAE5BZqiiPH94N43YzQg6jjZJjYe35o1jKWRrTnZE7pdvYHNyaafWAd8ZjiMtZY.EJBqAsgfURqlmFgsQH60vuqoptvroq1sTrgsBW0l8IY&dib_tag=se&m=A17D2BRD4YMT0X&qid=1725663113&refinements=p_4%3ASAMSUNG%2Cp_n_condition-type%3A17170958031%2Cp_123%3A46655%2Cp_6%3AA17D2BRD4YMT0X&s=electronics&sr=1-53&language=en_GB,https://m.media-amazon.com/images/I/71v2Kh5CtwL._AC_SL1500_.jpg,"[{'reviewer_name': 'Cliente de Amazon', 'review_rating': 'N/A', 'review_title': 'N/A', 'review_text': 'Llego un powerbank en lugar del telefono y ni siquiera era la caja del telefono que pedi.  Muy mal esto. Ya pedi devolucion pero ahora tengo que esperar nuevamente.\nRead more', 'review_date': 'Reviewed in Mexico on 23 May 2023'}, {'reviewer_name': 'Angelica Dellera', 'review_rating': 'N/A', 'review_title': 'N/A', 'review_text': 'I love it\nRead more', 'review_date': 'Reviewed in the United Arab Emirates on 27 August 2024'}, {'reviewer_name': 'Simon Love', 'review_rating': 'N/A', 'review_title': 'N/A', 'review_text': 'Perfect in condition and delivery\nRead more', 'review_date': 'Reviewed in Belgium on 18 August 2024'}, {'reviewer_name': 'Nicola Courtney', 'review_rating': 'N/A', 'review_title': 'N/A', 'review_text': 'Really good phone, well priced, 5g, good charging, brill features really just a well rounded decent phone.\nRead more', 'review_date': 'Reviewed in the United Kingdom on 17 August 2024'}, {'reviewer_name': 'Roberto Delgado Alcázar', 'review_rating': 'N/A', 'review_title': 'N/A', 'review_text': 'Definitivamente, este móvil es genial considerando lo que pagué. Me sorprende lo rápido que va, todo se mueve sin problemas y la cámara es de alta calidad. La batería dura un montón. Si estás buscando un buen teléfono a buen precio, este es el indicado.\nRead more', 'review_date': 'Reviewed in Spain on 8 August 2024'}]",Amazon NL
GALAXY S23FE BLACK 256Go,SAMSUNG,android,,,256 GB,6.4 Inches,,,Galaxy S23 FE,"GSM, LTE",Dubbele simkaart,Unlocked,2G,,Black,€509.00,€759.00,€,4.4 out of 5 stars,https://www.amazon.nl/-/en/HP03353-GALAXY-S23FE-BLACK-256Go/dp/B0CN46QXQN/ref=sr_1_15?dib=eyJ2IjoiMSJ9._38P4doI_dwPqmWAf6Cg50RGzpY4xRMdsQTY2fue4J3LA1rmGoCufPF8cQY5s2-TyQDCO9QfJowte634FVptXNDzuLc-EOOdMImNc6yZpsVGwiokt2MMuavBM5uMJ70_kivKhUZtUGgzQIX_f8Lh3A97fZPM-6Hls1LuM0EbMxmrACSWdr_L7iWSD59m0LUHX-2-_Etk6jqrDqdGd_sIke-5Y0KLzfdaWWdvPTTWm0bPhcVn_y47xw8sT8yVdIZlD2JSNTHQUmiSf9uPT8cH3DvTMjefdyL2MLxVlJWOi0s.s0Z7plUrybBMes7BDKo6Me5jrbKpcZFGzndofafe7uE&dib_tag=se&m=A17D2BRD4YMT0X&qid=1725663109&refinements=p_4%3ASAMSUNG%2Cp_n_condition-type%3A17170958031%2Cp_123%3A46655%2Cp_6%3AA17D2BRD4YMT0X&s=electronics&sr=1-15&language=en_GB,https://m.media-amazon.com/images/I/61PNZwqXGNL._AC_SL1500_.jpg,"[{'reviewer_name': 'Manuel', 'review_rating': 'N/A', 'review_title': 'N/A', 'review_text': 'Smartphon esattamente come descritto, arrivato 2 giorni di anticipo del previsto.\nRead more', 'review_date': 'Reviewed in Italy on 21 August 2024'}, {'reviewer_name': 'Petra Berlin', 'review_rating': 'N/A', 'review_title': 'N/A', 'review_text': 'Das Smartphone war für meine Freundin. Sie ist damit sehr zufrieden.\nRead more', 'review_date': 'Reviewed in Germany on 7 August 2024'}, {'reviewer_name': 'Gabriel Doce', 'review_rating': 'N/A', 'review_title': 'N/A', 'review_text': 'Nada que agregar a esta excelente marca\nRead more', 'review_date': 'Reviewed in Spain on 13 July 2024'}, {'reviewer_name': 'Amazon Kunde', 'review_rating': 'N/A', 'review_title': 'N/A', 'review_text': 'Smartfon ist so wie beschrieben. Geliefert in 2 Tage. Abgeholt wurde über Amazonabholstation problemlos ohne irgendwelche Einmalcode.\nRead more', 'review_date': 'Reviewed in Germany on 1 August 2024'}, {'reviewer_name': 'Iban', 'review_rating': 'N/A', 'review_title': 'N/A', 'review_text': 'El teléfono es perfectos sin ningún problema y más barato que en la tienda una compra muy acertada\nRead more', 'review_date': 'Reviewed in Spain on 30 May 2024'}]",Amazon NL
SAMSUNG Smartphone Galaxy Z Flip4 Blue 6.7 inch 128 GB Octa-Core 8 GB RAM,,,,,,,,,,,,,,,,"€1,474.24",,€,5.0 out of 5 stars,https://www.amazon.nl/-/en/SAMSUNG-Smartphone-Galaxy-Flip4-Octa-Core/dp/B0CBMSLPGW/ref=sr_1_75?dib=eyJ2IjoiMSJ9.wLLVIcni-SJ9xpnEeWKynYzchCPGP9haMVMI5x2Y5Vac5g820iPtGPkLbVOp1RuJu77Tu3xWzVrN39S9rcGCoV1RJXVL75DxXFIZd-nhha7Bn7fAJLM0yhZo0lUQc2HU5zBP6UCVMNnV49WJJl5NbQN8YaFCiV-SRqDzSmwaqJmexVVfqgOR9Ad3YXAzgVv66eRSm6X5H1Jd0puscGe0uFOOC-uDN_n1PQU49H-pSAwQWmhEOu47LN451j1q7sHIAGn8U2tZvxeSul2qrqf4ZpZMGlq3RQyWza3Ga-cnwMA.mCN9kEE1DST8GHPFMz_GJdFKUvNrXKJkJx1HIL_TNzc&dib_tag=se&m=A17D2BRD4YMT0X&qid=1725663115&refinements=p_4%3ASAMSUNG%2Cp_n_condition-type%3A17170958031%2Cp_123%3A46655%2Cp_6%3AA17D2BRD4YMT0X&s=electronics&sr=1-75&language=en_GB,https://m.media-amazon.com/images/I/61jDfFHJWtL._AC_SL1200_.jpg,[],Amazon NL
"Samsung Galaxy S20 Ultra Smartphone, 5G, 6.9 Inch Display Dynamic AMOLED 2X, 4 Rear Cameras, 128 GB Expandable, RAM 12 GB, 5000 mAh, Hybrid SIM/eSIM, Gray (Cosmic)",SAMSUNG,Android 10.0,,,128 GB,6.9 Inches,,,Galaxy S20 Ultra,"GSM, CDMA, LTE",,Unlocked for All Carriers,5G,,Grey,€887.33,,€,4.1 out of 5 stars,https://www.amazon.nl/-/en/Samsung-Smartphone-Display-Dynamic-Expandable/dp/B084LFXW1K/ref=sr_1_37?dib=eyJ2IjoiMSJ9.3OXEVbaRGUfBvOh6xVX1CFCjBAPfO-clCz3DBf3OuiGfw7aqNAxqmplpc9du7aNnCbLpTB7SYfilWSkqPlpnlIEiNQNf1de0lVLRCqY6b6pr8xzoSFIekJk8S1Z8Q62oi4lbSSge3uWTbeweLJRxDV0TIYdKXjPH78zPq99icFxAwkLaEWiQzCrGyX91HUb3vnVZ5nUUFVB5-z_tj7jrCPr_XW5534URyCRxGGn6fXSG3kriiYFy_cfxcgQZjiB5Y5bjXH6vh3S2UrV5zGxxcf9tP9tcNn0F2iwaqVt9mvg.4xebUwPhX6FXiAixIBbjwUMvBPKNr3OtY-0NoH9Asqg&dib_tag=se&m=A17D2BRD4YMT0X&qid=1725663112&refinements=p_4%3ASAMSUNG%2Cp_n_condition-type%3A17170958031%2Cp_123%3A46655%2Cp_6%3AA17D2BRD4YMT0X&s=electronics&sr=1-37&language=en_GB,https://m.media-amazon.com/images/I/61W5Ex6V2mL._AC_SL1500_.jpg,"[{'reviewer_name': 'Adolf Diedrichs', 'review_rating': 'N/A', 'review_title': 'N/A', 'review_text': 'Das Handy war ein gelungenes Geschenk fürEin gelungenes Fest. Und durfte an Großen Grill Abend teilnehmen.Alles in allem große Freude 😚\nRead more', 'review_date': 'Reviewed in Germany on 7 August 2024'}, {'reviewer_name': 'Cliente Amazon', 'review_rating': 'N/A', 'review_title': 'N/A', 'review_text': 'Arrivato il giorno dopo, sigillato, perfetto e perfettamente funzionante. Ha soddisfatto le mie aspettative\nRead more', 'review_date': 'Reviewed in Italy on 23 March 2024'}, {'reviewer_name': 'Cliente Amazon', 'review_rating': 'N/A', 'review_title': 'N/A', 'review_text': 'El teléfono ha llegado en perfectas condiciones, todo correcto, el embalaje estaba en muy mal estado, pero la caja interior no había sufrido daño alguno. 10/10\nRead more', 'review_date': 'Reviewed in Spain on 9 July 2021'}, {'reviewer_name': 'Sufyan Asghar', 'review_rating': 'N/A', 'review_title': 'N/A', 'review_text': ""New box opened but device isn't working properly,,,battery, camera and display issues.\nRead more"", 'review_date': 'Reviewed in the United Arab Emirates on 12 April 2024'}, {'reviewer_name': 'Silvia Robl', 'review_rating': 'N/A', 'review_title': 'N/A', 'review_text': 'Das beste Handy aller Zeiten!\nRead more', 'review_date': 'Reviewed in Germany on 1 June 2021'}]",Amazon NL
GALAXY S24 + 12/512 VIOLET,SAMSUNG,Android 10.0,,,512 GB,,3120 x 1440,,Galaxy S24 Plus,"Wi-Fi, LTE",,Unlocked for All Carriers,5G,,Black,"€1,069.00",,€,4.8 out of 5 stars,https://www.amazon.nl/-/en/GALAXY-S24-12-512-VIOLET/dp/B0CSTBMDG1/ref=sr_1_38?dib=eyJ2IjoiMSJ9.3OXEVbaRGUfBvOh6xVX1CFCjBAPfO-clCz3DBf3OuiGfw7aqNAxqmplpc9du7aNnCbLpTB7SYfilWSkqPlpnlIEiNQNf1de0lVLRCqY6b6pr8xzoSFIekJk8S1Z8Q62oi4lbSSge3uWTbeweLJRxDV0TIYdKXjPH78zPq99icFxAwkLaEWiQzCrGyX91HUb3vnVZ5nUUFVB5-z_tj7jrCPr_XW5534URyCRxGGn6fXSG3kriiYFy_cfxcgQZjiB5Y5bjXH6vh3S2UrV5zGxxcf9tP9tcNn0F2iwaqVt9mvg.4xebUwPhX6FXiAixIBbjwUMvBPKNr3OtY-0NoH9Asqg&dib_tag=se&m=A17D2BRD4YMT0X&qid=1725663112&refinements=p_4%3ASAMSUNG%2Cp_n_condition-type%3A17170958031%2Cp_123%3A46655%2Cp_6%3AA17D2BRD4YMT0X&s=electronics&sr=1-38&language=en_GB,https://m.media-amazon.com/images/I/613ROQ3YlPL._AC_SL1200_.jpg,"[{'reviewer_name': 'Jürgen', 'review_rating': 'N/A', 'review_title': 'N/A', 'review_text': 'Mein altes S10 gegen das S24+ getauscht, einfach hervorragendes Smartphone\nRead more', 'review_date': 'Reviewed in Germany on 26 August 2024'}, {'reviewer_name': 'Karen Lillywhite', 'review_rating': 'N/A', 'review_title': 'N/A', 'review_text': 'So far so good. I transferred across my old phone to my new one and all is working nicely ☺️\nRead more', 'review_date': 'Reviewed in the United Kingdom on 2 June 2024'}, {'reviewer_name': 'Rose-Véra', 'review_rating': 'N/A', 'review_title': 'N/A', 'review_text': ""Commande reçue avant la date indiquée. Colis soigné et sous blister. Ma commande a été déposée dzns un point relais et je l'ai récupéré vendredi. Et depuis, je l'utilise. Très beau design. Couleur violet. Prise en main facile. Je suis une adepte de Samsung depuis des années. Je maîtrise. Facile a utilisé : transfert de l'ancien téléphone au nouveau se fait rapidement. Pas déçue de mon achat. Je recommande. Vendeur de confiance.\nRead more"", 'review_date': 'Reviewed in France on 6 May 2024'}, {'reviewer_name': 'Amazon Kunde', 'review_rating': 'N/A', 'review_title': 'N/A', 'review_text': 'Lang anhaltender akku, gutes intuitives bedienen\nRead more', 'review_date': 'Reviewed in Germany on 23 August 2024'}, {'reviewer_name': 'Meyer77', 'review_rating': 'N/A', 'review_title': 'N/A', 'review_text': 'Kurz gesagt; Die Lieferung war schnell. Original verpackt und keine Beschädigung. Bin sehr zufrieden.Gern wieder einmal.\nRead more', 'review_date': 'Reviewed in Germany on 12 July 2024'}]",Amazon NL
