Title,Brand,OS,RAM,CPU,Storage,Screen Size,Resolution,CPU Speed,Model,Wireless Technology,SIM Count,Wireless Provider,Cellular Technology,Camera,Color,Price,Price Before Promotion,Currancy,Rate,URL,IMG,Reviews,Website
GALAXY S23FE PURPLE 256Go,SAMSUNG,Android 13.0,,,256 GB,,,,Galaxy S23 FE,"GSM, LTE",Dubbele simkaart,Unlocked,5G,,Black,€509.00,€759.00,€,3.9 out of 5 stars,https://www.amazon.nl/-/en/HP03355-GALAXY-S23FE-PURPLE-256Go/dp/B0CN47MXSY/ref=sr_1_56?dib=eyJ2IjoiMSJ9.h-o9j2CGAT82QG2_Blb0QwGHhE9y_68HfsznsYll2goDgDlL-czh2HljU0rEwakrtcISxa51DFTKy0HiIWQGuNCgC8kBbEmu5YF_ca2GXR3OHhxwSfu8q3NnZwYGtR8qVQnuRixHMluIlha1p4yQ6WYMnFeAhnVh8LsrbeY_a7J1ua3qwRR5_3SkpbQW6GNauBy75tqKRiTxJxcrq4gAEU_kvmrhejGFVauG0PPzzbEJtAE5BZqiiPH94N43YzQg6jjZJjYe35o1jKWRrTnZE7pdvYHNyaafWAd8ZjiMtZY.EJBqAsgfURqlmFgsQH60vuqoptvroq1sTrgsBW0l8IY&dib_tag=se&m=A17D2BRD4YMT0X&qid=1725663113&refinements=p_4%3ASAMSUNG%2Cp_n_condition-type%3A17170958031%2Cp_123%3A46655%2Cp_6%3AA17D2BRD4YMT0X&s=electronics&sr=1-56&language=en_GB,https://m.media-amazon.com/images/I/61TQNnKed8L._AC_SL1500_.jpg,"[{'reviewer_name': 'Jacky breton', 'review_rating': 'N/A', 'review_title': 'N/A', 'review_text': ""Tout va très bien, je suis enchantée par cet article. Je veux simplement obtenir une facture afin de reporter l'assurance de mon ancien téléphone sur celui-ci.J'ai réclamé par votre intermédiaire et il m'a été dit que si le 31 août, donc aujourd'hui je n'avais rien, je revienne vers vous.\nRead more"", 'review_date': 'Reviewed in France on 31 August 2024'}, {'reviewer_name': 'Amazonkunde', 'review_rating': 'N/A', 'review_title': 'N/A', 'review_text': 'Super zufriedenstellende Lieferung durch Amazon und Trading Europe, dem Verkäufer. Aber das nur vorweg.In verschiedenen Tests wurde immer wieder gesagt: zu spät, nicht leistungsstark genug, zu teuer, veraltete Technik...Gut, billig ist es nicht, aber mit  256er Speicher dürfte im 2. Quartal 24 ein Preis von deutlich unter 600 € erreicht werden, der als angemessen gelten kann.Ob das Leistungsangebot ausreicht, hängt ja doch aber allein vom Nutzer ab.Ich hatte seit 2019 ein A50 in Nutzung. 126er Speicher, 6 GB RAM, Kamera 12 MP. Nutzung: Telefon, WhatsApp, Einkäufe, Banking und, überwiegend im Urlaub, einige Fotos. Keine Spiele, Streamings, Playlists, große Downloads... dafür reichlich Google-Nutzung, Android Auto mit TomTom go und Speichern, sowie Auslagern über MS Onedrive, dank Family 365 mit 1TB.Lief alles soweit prima, nur ließ jetzt doch die Akkuleistung nach und Updates gibts seit einem Jahr nicht mehr.Also auf das A55 warten?Das A54 hat jemand in der Familie. Völlig okay, aber eigentlich wollte ich doch irgendwie ""mehr""....Ich habe mir dann in meinem weiteren Umfeld das S23 (zu klein von den Abmessungen), das S24+ (nur minimal größer und über 1.000 €) und das S23 Ultra angesehen. Letzteres hatte ansprechende Abmaße, aber auch einen immer noch 4-stelligen Betrag für Technik und Möglichkeiten, die ich eh nicht nutzen würde. Die 200er Kamera macht schon tolle Bilder, ja, aber im  Vergleich zu den 50 MP-Bildern ist das zwar sichtbar, aber mir nicht das Geld wert. Auch die 12 GB RAM sind bei meiner Nutzung nicht entscheidend. Letztlich war der Größenunterschied der Gehäuse auch nicht so wesentlich!Also wurde es das S23 FE, weil beim A55 voraussichtlich es wieder kein induktives Laden geben wird und die Haptik des FE sehr angenehm ist. Und ich den Preis gerade noch akzeptabel fand... Der einzig große Vorteil bei der S24-Reihe wäre die verlängerte Update-Zusage von Samsung. Ist nur die Frage wie es nach 4 Jahren mit deren Akku dann aussieht, auswechselbar, von Laien wie früher, sind die S-24er immer noch nicht... also mal schauen, was der Markt uns dann in ein paar Jahren so bietet, wenn das FE ersetzt werden muss...Vielleicht noch erwähnenswert: ich begann im Dezember 23 mich mit Tests und den Vorankündigungen vom S24 und S23 FE zu beschäftigen. Meine Frau, ihr A50 ist 2 Monate jünger und leidet auch an nachlassendem Akku, beäugte das Thema sehr mißtrauisch, da technisch nicht besonders interessiert. ""Frühstens Ende des Jahres 24, so lange muss mein ""Sams"" es noch tun"", so ihre Worte... Als mein FE da und eingerichtet war, überließ  ich das Teil ihr für einen Nachmittag und Abend um zu telefonieren, zu schreiben und zu googlen. Vor allem die Kamera hatte es ihr angetan. Nach weiteren Erläuterungen und Erklärungen stand von ihr fest: ""Das will ich auch!"". Also gleich bestellt..... Sie ist völlig begeistert, nur das Einrichten hat sie mir überlassen...😉Wer mit der A-Reihe an sich zufrieden ist, aber sich ""ein wenig mehr"" wünscht, auf Highendtechnik, Image und riesen Speicherplatz verzichten kann, aber auch auf den Preis schaut, für den kann das S23 FE durchaus Sinn  machen, wenn nach 3 bis 4 Jahren was Neues  her muss. Von Prozessorüberhitzung und ähnlichen Dingen konnte ich nichts feststellen. Auch der häufig kritisierte Breite Rand um das Display spielt in der Praxis in einer Hülle nachher keine Rolle. Der Akku (Einstellung max. 85% Ladung) hält bei reichlicher Nutzung, gerade jetzt bei Einrichtung und Erkundung  locker einen Tag, später sicher deutlich länger, wenn entsprechend Display aus nach 2 min und sinnvoll mit der Energie umgegangen wird.Für den durchschnittlich ambitionierten, eher bodenständigen Handynutzer mit technischen Interesse ist das S23 FE auf jeden Fall eine Überlegung wert, die für die Nutzung Luft nach oben lässt und bei Bedarf dann auch eingesetzt werden kann.Wer beim Kauf sich sämtliche Coverfarben ansieht, kann einiges an Geld sparen. Unsere Handys sind in Klapphüllen, die das Gerät vollständig schützen und nur um die Linsen herum minimal die Farbe erkennen lassen. So trübt die gruselige Farbe Purple (cremelila) nicht die Freude...\nRead more', 'review_date': 'Reviewed in Germany on 4 March 2024'}, {'reviewer_name': 'katryn', 'review_rating': 'N/A', 'review_title': 'N/A', 'review_text': ""Ce tel est très lourd plus de 200g. Avec une vitre de protection c'est pire. Trop lourd.Ne tient pas la charge. Neuf il tient moins de 10hPas de carte SD possible.Je ne vois aucune différence avec le S20FE. Pour 3 fois son prix. JE suis très décue\nRead more"", 'review_date': 'Reviewed in France on 1 June 2024'}, {'reviewer_name': 'Uwe Thran', 'review_rating': 'N/A', 'review_title': 'N/A', 'review_text': 'Das Smartphon macht einen guten und edlen Eindruck. Jedoch ist es etwas zu schwer.\nRead more', 'review_date': 'Reviewed in Germany on 23 May 2024'}, {'reviewer_name': 'J’ai envoyé trois pièces d’une cartonne avec un etecete. J’ai pas encore reçu le remboursement ?', 'review_rating': 'N/A', 'review_title': 'N/A', 'review_text': 'J’ai envoyé trois pièces avec un etecette\nRead more', 'review_date': 'Reviewed in France on 11 August 2024'}]",Amazon NL
"Samsung Galaxy S20+ Smartphone Bundle 6.7 Inch, 128 GB, Cosmic Grey",SAMSUNG,android,,,8 GB,6.7 Inches,,,Galaxy S20+,LTE,,,4G,,Cosmic Grey (Grey),"€1,029.00",,€,4.6 out of 5 stars,https://www.amazon.nl/-/en/Samsung-Galaxy-Smartphone-Bundle-Cosmic/dp/B084DQ5BDJ/ref=sr_1_121?dib=eyJ2IjoiMSJ9.ACCVWqLowwIzyG4mYQrktJtzu5aW7_E5KkCWZEieZ0Aqu3WGfe9MC3SoxVOeXxFDgBEs_GdD8qg02GOTbVv6fjQpe0Wor4vNuFf4tA2apCO8LnUqTcjkdnbv_HJ8CCtwJvisReRZS6Vs3MkVJtydtNv2xIk2vwullVzf9ypJrPjd5SNS7mahqmCke6c8JO-d-e2wUIf7Ez2q_sHzWTJhmQE9NsdcPqzRBWpLw5LEAzpipyBhpnFG84rdf9ojHEbVhEm8h-pfugk-Lu8X1gvzBno-BSTaDV82udRYvEYb358.e2JmLe5aP83BXLH5CkPB7L7lEjUwLDHT8tV63_UX_hA&dib_tag=se&m=A17D2BRD4YMT0X&qid=1725663118&refinements=p_4%3ASAMSUNG%2Cp_n_condition-type%3A17170958031%2Cp_123%3A46655%2Cp_6%3AA17D2BRD4YMT0X&s=electronics&sr=1-121&language=en_GB,https://m.media-amazon.com/images/I/71EzBaGwVVL._AC_SL1500_.jpg,"[{'reviewer_name': 'Missnöjd', 'review_rating': 'N/A', 'review_title': 'N/A', 'review_text': 'Gick ej att starta efter laddning\nRead more', 'review_date': 'Reviewed in Sweden on 2 August 2024'}, {'reviewer_name': 'thorgal17', 'review_rating': 'N/A', 'review_title': 'N/A', 'review_text': 'Reçu ce matincharge et prêt a servirparfait\nRead more', 'review_date': 'Reviewed in France on 18 March 2024'}, {'reviewer_name': 'Cliente Amazon', 'review_rating': 'N/A', 'review_title': 'N/A', 'review_text': 'Piccolo graffietto di meno di un cm sul display che si nota solo in controluce per il resto è come nuovo batteria quasi nuova\nRead more', 'review_date': 'Reviewed in Italy on 9 July 2022'}, {'reviewer_name': 'Amazon Customer', 'review_rating': 'N/A', 'review_title': 'N/A', 'review_text': 'techniquement le smartphone est pas mal\nRead more', 'review_date': 'Reviewed in France on 7 May 2021'}, {'reviewer_name': 'Cliente Amazon', 'review_rating': 'N/A', 'review_title': 'N/A', 'review_text': 'Muy Mala batería y mal x Amazon porque lo compre reacondicionado en estado bueno y me enviaron el móvil solo sin accesorios ni caja y eso no lo decían, y la devolución del dinero hasta dentro de 15 días  no lo devuelven\nRead more', 'review_date': 'Reviewed in Spain on 8 February 2021'}]",Amazon NL
Samsung GSM036957 pencil case,SAMSUNG,,,,,2.4,,,,,,,,,,€11.19,,€,5.0 out of 5 stars,https://www.amazon.nl/-/en/GSM036957-Samsung-pencil-case/dp/B07HP8TX39/ref=sr_1_131?dib=eyJ2IjoiMSJ9.ACCVWqLowwIzyG4mYQrktJtzu5aW7_E5KkCWZEieZ0Aqu3WGfe9MC3SoxVOeXxFDgBEs_GdD8qg02GOTbVv6fjQpe0Wor4vNuFf4tA2apCO8LnUqTcjkdnbv_HJ8CCtwJvisReRZS6Vs3MkVJtydtNv2xIk2vwullVzf9ypJrPjd5SNS7mahqmCke6c8JO-d-e2wUIf7Ez2q_sHzWTJhmQE9NsdcPqzRBWpLw5LEAzpipyBhpnFG84rdf9ojHEbVhEm8h-pfugk-Lu8X1gvzBno-BSTaDV82udRYvEYb358.e2JmLe5aP83BXLH5CkPB7L7lEjUwLDHT8tV63_UX_hA&dib_tag=se&m=A17D2BRD4YMT0X&qid=1725663118&refinements=p_4%3ASAMSUNG%2Cp_n_condition-type%3A17170958031%2Cp_123%3A46655%2Cp_6%3AA17D2BRD4YMT0X&s=electronics&sr=1-131&language=en_GB,https://m.media-amazon.com/images/I/418z4baww5L._AC_SL1212_.jpg,[],Amazon NL
Samsung Galaxy S21 + 128GB Purple,SAMSUNG,android,,,8 GB,6.7,,,,Wi-Fi,,Unlocked for All Carriers,5G,,"Purple, Purple",€987.33,,€,4.3 out of 5 stars,https://www.amazon.nl/-/en/Samsung-Galaxy-S21-128GB-Purple/dp/B08R9487XL/ref=sr_1_48?dib=eyJ2IjoiMSJ9.3OXEVbaRGUfBvOh6xVX1CFCjBAPfO-clCz3DBf3OuiGfw7aqNAxqmplpc9du7aNnCbLpTB7SYfilWSkqPlpnlIEiNQNf1de0lVLRCqY6b6pr8xzoSFIekJk8S1Z8Q62oi4lbSSge3uWTbeweLJRxDV0TIYdKXjPH78zPq99icFxAwkLaEWiQzCrGyX91HUb3vnVZ5nUUFVB5-z_tj7jrCPr_XW5534URyCRxGGn6fXSG3kriiYFy_cfxcgQZjiB5Y5bjXH6vh3S2UrV5zGxxcf9tP9tcNn0F2iwaqVt9mvg.4xebUwPhX6FXiAixIBbjwUMvBPKNr3OtY-0NoH9Asqg&dib_tag=se&m=A17D2BRD4YMT0X&qid=1725663112&refinements=p_4%3ASAMSUNG%2Cp_n_condition-type%3A17170958031%2Cp_123%3A46655%2Cp_6%3AA17D2BRD4YMT0X&s=electronics&sr=1-48&language=en_GB,https://m.media-amazon.com/images/I/81eE38r4hyL._AC_SL1500_.jpg,"[{'reviewer_name': 'JOAQUIM', 'review_rating': 'N/A', 'review_title': 'N/A', 'review_text': 'Se lo regalé a mi novia hace 2 meses y es una manos tijeras y todavía funciona sin problemas, con lo que le doy las 5 estrellas.\nRead more', 'review_date': 'Reviewed in Spain on 25 November 2023'}, {'reviewer_name': 'Gino', 'review_rating': 'N/A', 'review_title': 'N/A', 'review_text': 'Servizio impeccabile, spedizione arrivata in anticipo e prodotto perfetto come da descrizione, consiglio vivamente\nRead more', 'review_date': 'Reviewed in Italy on 21 February 2022'}, {'reviewer_name': 'Jose Antonio', 'review_rating': 'N/A', 'review_title': 'N/A', 'review_text': 'Fue un regalo para mi mujer y esta encantada con el,muy contento con la compra y con el producto,hace unas fotacas muy buenas.La batería pues como todos 1 día y listo pero es normal cuanto estamos 24 horas pegados al teléfono..\nRead more', 'review_date': 'Reviewed in Spain on 30 December 2021'}, {'reviewer_name': 'Jenifer', 'review_rating': 'N/A', 'review_title': 'N/A', 'review_text': 'Perfecto,viene con cable usb y cascos , es el plus. Estoy in loveee con el\nRead more', 'review_date': 'Reviewed in Spain on 6 October 2021'}, {'reviewer_name': 'Cliente Amazon', 'review_rating': 'N/A', 'review_title': 'N/A', 'review_text': 'todo muy bien, las fotos estupendas\nRead more', 'review_date': 'Reviewed in Spain on 16 October 2021'}]",Amazon NL
Samsung BRA005234 pencil case,SAMSUNG,,,,,1.6,,,,,,,,,,€16.31,,€,5.0 out of 5 stars,https://www.amazon.nl/-/en/BRA005234-Samsung-pencil-case/dp/B07BGBMQ6B/ref=sr_1_158?dib=eyJ2IjoiMSJ9.t5B-9n3EF0GrHplbyQlm7UYgNGz0GQx0O2OULXOViPXDOF3MG6AjVEh8f-Mz48P1hO3acWYOfd3DhICQu4M3wEWqUba0xMhP_4Jf_uiJHSyktppUdRylf79YLgaOCyUbcFGgJWaymawEy1c0FSS4ZPELXWwAggueDp0bZ-8lj0e95EJDELw7E4uMM3G4OLmJuCWT1td5qJxt1118lMoEylwROr8d2FYC_HHdFly2joxtFwLHBK35I6ASv1QbDjy3nNAFy9ELhVB1mpRpA5OC-H9Yci8Rr0xVfZuswJijFSg.5lxl5E1sr1NV-krSq4qz_f0MeDNXKdq4F8AqJ5HMVk0&dib_tag=se&m=A17D2BRD4YMT0X&qid=1725663120&refinements=p_4%3ASAMSUNG%2Cp_n_condition-type%3A17170958031%2Cp_123%3A46655%2Cp_6%3AA17D2BRD4YMT0X&s=electronics&sr=1-158&language=en_GB,https://m.media-amazon.com/images/I/51HO9ebMf7L._AC_SL1000_.jpg,[],Amazon NL
